{
  "schemaVersion": 1,
  "id": "clip_bff4db3f1a5a9a03ff21a4cd0192e5116bdc5b96c8433eb336a3937eecd20aa5",
  "sha256": "bff4db3f1a5a9a03ff21a4cd0192e5116bdc5b96c8433eb336a3937eecd20aa5",
  "bytes": 1639828,
  "extension": ".mp4",
  "kind": "unknown",
  "technical": {
    "durationSeconds": 8,
    "width": 720,
    "height": 1280,
    "frameRate": "24/1",
    "frameCount": 192,
    "videoCodec": "h264",
    "audioCodec": "aac"
  },
  "labels": [
    "Closeup_continues_on_202601140419_32mga.mp4"
  ],
  "collections": [],
  "legacyIds": [],
  "generations": [],
  "analysis": [],
  "characters": [],
  "tags": [],
  "availability": {
    "status": "local-only",
    "urls": [],
    "license": null
  }
}
