{
  "schemaVersion": 1,
  "id": "clip_0ec4cba6ff4915ee20c7065bdc625c9d07d09e80c1d67ac2bb8dd5228f924370",
  "sha256": "0ec4cba6ff4915ee20c7065bdc625c9d07d09e80c1d67ac2bb8dd5228f924370",
  "bytes": 17769924,
  "extension": ".mp4",
  "kind": "derived",
  "technical": {
    "durationSeconds": 332.083333,
    "width": 2560,
    "height": 1440,
    "frameRate": "24/1",
    "frameCount": 7970,
    "videoCodec": "h264",
    "audioCodec": null
  },
  "labels": [
    "fgc_06.mp4"
  ],
  "collections": [
    "surveyors-table"
  ],
  "legacyIds": [],
  "generations": [],
  "analysis": [],
  "characters": [],
  "tags": [],
  "availability": {
    "status": "local-only",
    "urls": [],
    "license": null
  }
}
