{
  "schemaVersion": 1,
  "id": "clip_44eb2ea3393f9e4ff97011934fa35852525795c2ce02e788a899577ae9f13717",
  "sha256": "44eb2ea3393f9e4ff97011934fa35852525795c2ce02e788a899577ae9f13717",
  "bytes": 1393437,
  "extension": ".mp4",
  "kind": "derived",
  "technical": {
    "durationSeconds": 34.083333,
    "width": 960,
    "height": 540,
    "frameRate": "24/1",
    "frameCount": 818,
    "videoCodec": "h264",
    "audioCodec": null
  },
  "labels": [
    "future5_u1.mp4"
  ],
  "collections": [
    "surveyors-table"
  ],
  "legacyIds": [],
  "generations": [],
  "analysis": [],
  "characters": [],
  "tags": [],
  "availability": {
    "status": "local-only",
    "urls": [],
    "license": null
  }
}
