{
  "schemaVersion": 1,
  "id": "clip_72de7182797ee4f14ef09e23c264aa3a8dfdee2cd7d5a2529054de453e2ef1e7",
  "sha256": "72de7182797ee4f14ef09e23c264aa3a8dfdee2cd7d5a2529054de453e2ef1e7",
  "bytes": 8193599,
  "extension": ".mp4",
  "kind": "unknown",
  "technical": {
    "durationSeconds": 4,
    "width": 1080,
    "height": 1920,
    "frameRate": "24/1",
    "frameCount": 96,
    "videoCodec": "h264",
    "audioCodec": "aac"
  },
  "labels": [
    "sow-body.mp4"
  ],
  "collections": [
    "may-2026"
  ],
  "legacyIds": [],
  "generations": [],
  "analysis": [],
  "characters": [],
  "tags": [],
  "availability": {
    "status": "local-only",
    "urls": [],
    "license": null
  }
}
