{
  "schemaVersion": 1,
  "id": "clip_5835a85ece127c476b5a2b6e30ab2407bb2a30bb25646fb1b93cebaf1a89fcef",
  "sha256": "5835a85ece127c476b5a2b6e30ab2407bb2a30bb25646fb1b93cebaf1a89fcef",
  "bytes": 10113,
  "extension": ".mp4",
  "kind": "derived",
  "technical": {
    "durationSeconds": 2,
    "width": 720,
    "height": 1280,
    "frameRate": "24/1",
    "frameCount": 48,
    "videoCodec": "h264",
    "audioCodec": "aac"
  },
  "labels": [
    "title_session_end_black.mp4"
  ],
  "collections": [],
  "legacyIds": [],
  "generations": [],
  "analysis": [],
  "characters": [],
  "tags": [],
  "availability": {
    "status": "local-only",
    "urls": [],
    "license": null
  }
}
