{
  "schemaVersion": 1,
  "id": "clip_9ab9880033186aef254635cee85dcfd113a792054532eded32cd22102f512b31",
  "sha256": "9ab9880033186aef254635cee85dcfd113a792054532eded32cd22102f512b31",
  "bytes": 6402508,
  "extension": ".mp4",
  "kind": "unknown",
  "technical": {
    "durationSeconds": 4,
    "width": 1080,
    "height": 1920,
    "frameRate": "24/1",
    "frameCount": 96,
    "videoCodec": "h264",
    "audioCodec": null
  },
  "labels": [
    "V09-lowsun.mp4"
  ],
  "collections": [
    "october"
  ],
  "legacyIds": [],
  "generations": [],
  "analysis": [],
  "characters": [],
  "tags": [],
  "availability": {
    "status": "local-only",
    "urls": [],
    "license": null
  }
}
