{
  "schemaVersion": 1,
  "id": "clip_98f8d91834e6f39c6ea87517a7f7b43bef0436b8b92a68b1587f6f50b1cb47db",
  "sha256": "98f8d91834e6f39c6ea87517a7f7b43bef0436b8b92a68b1587f6f50b1cb47db",
  "bytes": 21845544,
  "extension": ".mp4",
  "kind": "unknown",
  "technical": {
    "durationSeconds": 8,
    "width": 1080,
    "height": 1920,
    "frameRate": "24/1",
    "frameCount": 192,
    "videoCodec": "h264",
    "audioCodec": null
  },
  "labels": [
    "plankton1.mp4"
  ],
  "collections": [
    "full-disclosure"
  ],
  "legacyIds": [],
  "generations": [],
  "analysis": [],
  "characters": [],
  "tags": [],
  "availability": {
    "status": "local-only",
    "urls": [],
    "license": null
  }
}
